Enter password: ****
Welcome to the MySQL monitor.  Commands end with ; or \g.
Your MySQL connection id is 11
Server version: 8.0.30 MySQL Community Server - GPL

Copyright (c) 2000, 2022, Oracle and/or its affiliates.

Oracle is a registered trademark of Oracle Corporation and/or its
affiliates. Other names may be trademarks of their respective
owners.

Type 'help;' or '\h' for help. Type '\c' to clear the current input statement.

mysql> show databases;
+--------------------+
| Database           |
+--------------------+
| information_schema |
| learn              |
| mysql              |
| nttsactivity       |
| performance_schema |
| sakila             |
| sql_hr             |
| sql_inventory      |
| sql_invoicing      |
| sql_store          |
| sys                |
| world              |
+--------------------+
12 rows in set (0.00 sec)

mysql> use learn;
Database changed
mysql> show tables;
Empty set (0.00 sec)

mysql> create table my_table( id int(10) primary key , name varchar(40) not null, city varchar(30));
Query OK, 0 rows affected, 1 warning (0.01 sec)

mysql> desc my_table;
+-------+-------------+------+-----+---------+-------+
| Field | Type        | Null | Key | Default | Extra |
+-------+-------------+------+-----+---------+-------+
| id    | int         | NO   | PRI | NULL    |       |
| name  | varchar(40) | NO   |     | NULL    |       |
| city  | varchar(30) | YES  |     | NULL    |       |
+-------+-------------+------+-----+---------+-------+
3 rows in set (0.00 sec)

mysql> alter table my_table rename to student;
Query OK, 0 rows affected (0.01 sec)

mysql> desc student;
+-------+-------------+------+-----+---------+-------+
| Field | Type        | Null | Key | Default | Extra |
+-------+-------------+------+-----+---------+-------+
| id    | int         | NO   | PRI | NULL    |       |
| name  | varchar(40) | NO   |     | NULL    |       |
| city  | varchar(30) | YES  |     | NULL    |       |
+-------+-------------+------+-----+---------+-------+
3 rows in set (0.00 sec)

mysql> insert into table student(id, name, city) values(1,'Tejas','Mumbai'),(2,'Ranjit','Mumbai'),(3,'Sanjay','Sangli'),(4,'Savitra','Solapur'),(5,'Ranjit','Satara'),(6,'Rupesh','Kohlapur');
ERROR 1064 (42000): You have an error in your SQL syntax; check the manual that corresponds to your MySQL server version for the right syntax to use near 'table student(id, name, city) values(1,'Tejas','Mumbai'),(2,'Ranjit','Mumbai'),(' at line 1
mysql> insert into student(id, name, city) values(1,'Tejas','Mumbai'),(2,'Ranjit','Mumbai'),(3,'Sanjay','Sangli'),(4,'Savitra','Solapur'),(5,'Ranjit','Satara'),(6,'Rupesh','Kohlapur');
Query OK, 6 rows affected (0.00 sec)
Records: 6  Duplicates: 0  Warnings: 0

mysql> alter table student add class;
ERROR 1064 (42000): You have an error in your SQL syntax; check the manual that corresponds to your MySQL server version for the right syntax to use near '' at line 1
mysql> alter table student add class int;
Query OK, 0 rows affected (0.01 sec)
Records: 0  Duplicates: 0  Warnings: 0

mysql> select * from student;
+----+---------+----------+-------+
| id | name    | city     | class |
+----+---------+----------+-------+
|  1 | Tejas   | Mumbai   |  NULL |
|  2 | Ranjit  | Mumbai   |  NULL |
|  3 | Sanjay  | Sangli   |  NULL |
|  4 | Savitra | Solapur  |  NULL |
|  5 | Ranjit  | Satara   |  NULL |
|  6 | Rupesh  | Kohlapur |  NULL |
+----+---------+----------+-------+
6 rows in set (0.00 sec)

mysql> update student set class = 14 where id;
Query OK, 6 rows affected (0.00 sec)
Rows matched: 6  Changed: 6  Warnings: 0

mysql> select * from student;
+----+---------+----------+-------+
| id | name    | city     | class |
+----+---------+----------+-------+
|  1 | Tejas   | Mumbai   |    14 |
|  2 | Ranjit  | Mumbai   |    14 |
|  3 | Sanjay  | Sangli   |    14 |
|  4 | Savitra | Solapur  |    14 |
|  5 | Ranjit  | Satara   |    14 |
|  6 | Rupesh  | Kohlapur |    14 |
+----+---------+----------+-------+
6 rows in set (0.00 sec)

mysql> update student set class = 15 where id = 2 OR id = 4 OR id = 6;
Query OK, 3 rows affected (0.00 sec)
Rows matched: 3  Changed: 3  Warnings: 0

mysql> select * from student;
+----+---------+----------+-------+
| id | name    | city     | class |
+----+---------+----------+-------+
|  1 | Tejas   | Mumbai   |    14 |
|  2 | Ranjit  | Mumbai   |    15 |
|  3 | Sanjay  | Sangli   |    14 |
|  4 | Savitra | Solapur  |    15 |
|  5 | Ranjit  | Satara   |    14 |
|  6 | Rupesh  | Kohlapur |    15 |
+----+---------+----------+-------+
6 rows in set (0.00 sec)

mysql> select * from student where class = 15;
+----+---------+----------+-------+
| id | name    | city     | class |
+----+---------+----------+-------+
|  2 | Ranjit  | Mumbai   |    15 |
|  4 | Savitra | Solapur  |    15 |
|  6 | Rupesh  | Kohlapur |    15 |
+----+---------+----------+-------+
3 rows in set (0.00 sec)

mysql> select * from student where class = 14;
+----+--------+--------+-------+
| id | name   | city   | class |
+----+--------+--------+-------+
|  1 | Tejas  | Mumbai |    14 |
|  3 | Sanjay | Sangli |    14 |
|  5 | Ranjit | Satara |    14 |
+----+--------+--------+-------+
3 rows in set (0.00 sec)

mysql> delete from student where id = 1;
Query OK, 1 row affected (0.00 sec)

mysql> select * from student ;
+----+---------+----------+-------+
| id | name    | city     | class |
+----+---------+----------+-------+
|  2 | Ranjit  | Mumbai   |    15 |
|  3 | Sanjay  | Sangli   |    14 |
|  4 | Savitra | Solapur  |    15 |
|  5 | Ranjit  | Satara   |    14 |
|  6 | Rupesh  | Kohlapur |    15 |
+----+---------+----------+-------+
5 rows in set (0.00 sec)

mysql> insert into student(id, name, city, class) values ( 1, 'Tejas', 'Mumbai',14);
Query OK, 1 row affected (0.00 sec)

mysql> select * from student ;
+----+---------+----------+-------+
| id | name    | city     | class |
+----+---------+----------+-------+
|  1 | Tejas   | Mumbai   |    14 |
|  2 | Ranjit  | Mumbai   |    15 |
|  3 | Sanjay  | Sangli   |    14 |
|  4 | Savitra | Solapur  |    15 |
|  5 | Ranjit  | Satara   |    14 |
|  6 | Rupesh  | Kohlapur |    15 |
+----+---------+----------+-------+
6 rows in set (0.00 sec)

mysql> select name, city, class from student;
+---------+----------+-------+
| name    | city     | class |
+---------+----------+-------+
| Tejas   | Mumbai   |    14 |
| Ranjit  | Mumbai   |    15 |
| Sanjay  | Sangli   |    14 |
| Savitra | Solapur  |    15 |
| Ranjit  | Satara   |    14 |
| Rupesh  | Kohlapur |    15 |
+---------+----------+-------+
6 rows in set (0.00 sec)

mysql> select name, city, class from student where city = 'Mumbai';
+--------+--------+-------+
| name   | city   | class |
+--------+--------+-------+
| Tejas  | Mumbai |    14 |
| Ranjit | Mumbai |    15 |
+--------+--------+-------+
2 rows in set (0.00 sec)

mysql> select name as "NAME", city as "CITY" from student;
+---------+----------+
| NAME    | CITY     |
+---------+----------+
| Tejas   | Mumbai   |
| Ranjit  | Mumbai   |
| Sanjay  | Sangli   |
| Savitra | Solapur  |
| Ranjit  | Satara   |
| Rupesh  | Kohlapur |
+---------+----------+
6 rows in set (0.00 sec)

mysql> select distinct (name) from Student;
+---------+
| name    |
+---------+
| Tejas   |
| Ranjit  |
| Sanjay  |
| Savitra |
| Rupesh  |
+---------+
5 rows in set (0.00 sec)

mysql> select distinct (city) from Student;
+----------+
| city     |
+----------+
| Mumbai   |
| Sangli   |
| Solapur  |
| Satara   |
| Kohlapur |
+----------+
5 rows in set (0.00 sec)

mysql> select * from student;
+----+---------+----------+-------+
| id | name    | city     | class |
+----+---------+----------+-------+
|  1 | Tejas   | Mumbai   |    14 |
|  2 | Ranjit  | Mumbai   |    15 |
|  3 | Sanjay  | Sangli   |    14 |
|  4 | Savitra | Solapur  |    15 |
|  5 | Ranjit  | Satara   |    14 |
|  6 | Rupesh  | Kohlapur |    15 |
+----+---------+----------+-------+
6 rows in set (0.00 sec)

mysql> select * from student where distinct(name) from student;
ERROR 1064 (42000): You have an error in your SQL syntax; check the manual that corresponds to your MySQL server version for the right syntax to use near 'distinct(name) from student' at line 1
mysql> select distinct() from student;
ERROR 1064 (42000): You have an error in your SQL syntax; check the manual that corresponds to your MySQL server version for the right syntax to use near ') from student' at line 1
mysql> select distinct from student;
ERROR 1064 (42000): You have an error in your SQL syntax; check the manual that corresponds to your MySQL server version for the right syntax to use near 'from student' at line 1
mysql> select * from student where city = 'Mumbai' AND class =15;
+----+--------+--------+-------+
| id | name   | city   | class |
+----+--------+--------+-------+
|  2 | Ranjit | Mumbai |    15 |
+----+--------+--------+-------+
1 row in set (0.00 sec)

mysql> select * from student where city = 'Mumbai' AND class = 15;
+----+--------+--------+-------+
| id | name   | city   | class |
+----+--------+--------+-------+
|  2 | Ranjit | Mumbai |    15 |
+----+--------+--------+-------+
1 row in set (0.00 sec)

mysql> select * from student where city = 'Mumbai' OR class = 15;
+----+---------+----------+-------+
| id | name    | city     | class |
+----+---------+----------+-------+
|  1 | Tejas   | Mumbai   |    14 |
|  2 | Ranjit  | Mumbai   |    15 |
|  4 | Savitra | Solapur  |    15 |
|  6 | Rupesh  | Kohlapur |    15 |
+----+---------+----------+-------+
4 rows in set (0.00 sec)

mysql> select * from student where NOT city = 'Mumbai';
+----+---------+----------+-------+
| id | name    | city     | class |
+----+---------+----------+-------+
|  3 | Sanjay  | Sangli   |    14 |
|  4 | Savitra | Solapur  |    15 |
|  5 | Ranjit  | Satara   |    14 |
|  6 | Rupesh  | Kohlapur |    15 |
+----+---------+----------+-------+
4 rows in set (0.00 sec)

mysql> select * from student where id >= 2 AND id <= 4;
+----+---------+---------+-------+
| id | name    | city    | class |
+----+---------+---------+-------+
|  2 | Ranjit  | Mumbai  |    15 |
|  3 | Sanjay  | Sangli  |    14 |
|  4 | Savitra | Solapur |    15 |
+----+---------+---------+-------+
3 rows in set (0.00 sec)

mysql> select * from student where id between 2 AND 4;
+----+---------+---------+-------+
| id | name    | city    | class |
+----+---------+---------+-------+
|  2 | Ranjit  | Mumbai  |    15 |
|  3 | Sanjay  | Sangli  |    14 |
|  4 | Savitra | Solapur |    15 |
+----+---------+---------+-------+
3 rows in set (0.00 sec)

mysql> select * from student where id > 2 AND id < 4;
+----+--------+--------+-------+
| id | name   | city   | class |
+----+--------+--------+-------+
|  3 | Sanjay | Sangli |    14 |
+----+--------+--------+-------+
1 row in set (0.00 sec)

mysql> select * from student where id in(2,4,6);
+----+---------+----------+-------+
| id | name    | city     | class |
+----+---------+----------+-------+
|  2 | Ranjit  | Mumbai   |    15 |
|  4 | Savitra | Solapur  |    15 |
|  6 | Rupesh  | Kohlapur |    15 |
+----+---------+----------+-------+
3 rows in set (0.00 sec)

mysql> select * from student where id limit 3;
+----+--------+--------+-------+
| id | name   | city   | class |
+----+--------+--------+-------+
|  1 | Tejas  | Mumbai |    14 |
|  2 | Ranjit | Mumbai |    15 |
|  3 | Sanjay | Sangli |    14 |
+----+--------+--------+-------+
3 rows in set (0.00 sec)

mysql> select * from student where id offset 3;
ERROR 1064 (42000): You have an error in your SQL syntax; check the manual that corresponds to your MySQL server version for the right syntax to use near 'offset 3' at line 1
mysql> select * from student where offset 3;
ERROR 1064 (42000): You have an error in your SQL syntax; check the manual that corresponds to your MySQL server version for the right syntax to use near '3' at line 1
mysql> select * from student where limit 2 offset 3;
ERROR 1064 (42000): You have an error in your SQL syntax; check the manual that corresponds to your MySQL server version for the right syntax to use near 'limit 2 offset 3' at line 1
mysql> select * from student where limit 2 offset 2;
ERROR 1064 (42000): You have an error in your SQL syntax; check the manual that corresponds to your MySQL server version for the right syntax to use near 'limit 2 offset 2' at line 1
mysql> select * from student limit 2 offset 2;
+----+---------+---------+-------+
| id | name    | city    | class |
+----+---------+---------+-------+
|  3 | Sanjay  | Sangli  |    14 |
|  4 | Savitra | Solapur |    15 |
+----+---------+---------+-------+
2 rows in set (0.00 sec)

mysql> select * from student offset 2;
ERROR 1064 (42000): You have an error in your SQL syntax; check the manual that corresponds to your MySQL server version for the right syntax to use near '2' at line 1
mysql> select * from student limit 3;
+----+--------+--------+-------+
| id | name   | city   | class |
+----+--------+--------+-------+
|  1 | Tejas  | Mumbai |    14 |
|  2 | Ranjit | Mumbai |    15 |
|  3 | Sanjay | Sangli |    14 |
+----+--------+--------+-------+
3 rows in set (0.00 sec)

mysql> select * from student where order by id;
ERROR 1064 (42000): You have an error in your SQL syntax; check the manual that corresponds to your MySQL server version for the right syntax to use near 'order by id' at line 1
mysql> select * from student order by id;
+----+---------+----------+-------+
| id | name    | city     | class |
+----+---------+----------+-------+
|  1 | Tejas   | Mumbai   |    14 |
|  2 | Ranjit  | Mumbai   |    15 |
|  3 | Sanjay  | Sangli   |    14 |
|  4 | Savitra | Solapur  |    15 |
|  5 | Ranjit  | Satara   |    14 |
|  6 | Rupesh  | Kohlapur |    15 |
+----+---------+----------+-------+
6 rows in set (0.00 sec)

mysql> select * from student order by id desc;
+----+---------+----------+-------+
| id | name    | city     | class |
+----+---------+----------+-------+
|  6 | Rupesh  | Kohlapur |    15 |
|  5 | Ranjit  | Satara   |    14 |
|  4 | Savitra | Solapur  |    15 |
|  3 | Sanjay  | Sangli   |    14 |
|  2 | Ranjit  | Mumbai   |    15 |
|  1 | Tejas   | Mumbai   |    14 |
+----+---------+----------+-------+
6 rows in set (0.00 sec)

mysql> select * from student order by id asc;
+----+---------+----------+-------+
| id | name    | city     | class |
+----+---------+----------+-------+
|  1 | Tejas   | Mumbai   |    14 |
|  2 | Ranjit  | Mumbai   |    15 |
|  3 | Sanjay  | Sangli   |    14 |
|  4 | Savitra | Solapur  |    15 |
|  5 | Ranjit  | Satara   |    14 |
|  6 | Rupesh  | Kohlapur |    15 |
+----+---------+----------+-------+
6 rows in set (0.00 sec)

mysql> select * from student order by name;
+----+---------+----------+-------+
| id | name    | city     | class |
+----+---------+----------+-------+
|  2 | Ranjit  | Mumbai   |    15 |
|  5 | Ranjit  | Satara   |    14 |
|  6 | Rupesh  | Kohlapur |    15 |
|  3 | Sanjay  | Sangli   |    14 |
|  4 | Savitra | Solapur  |    15 |
|  1 | Tejas   | Mumbai   |    14 |
+----+---------+----------+-------+
6 rows in set (0.00 sec)

mysql> select * from student order by name asc;
+----+---------+----------+-------+
| id | name    | city     | class |
+----+---------+----------+-------+
|  2 | Ranjit  | Mumbai   |    15 |
|  5 | Ranjit  | Satara   |    14 |
|  6 | Rupesh  | Kohlapur |    15 |
|  3 | Sanjay  | Sangli   |    14 |
|  4 | Savitra | Solapur  |    15 |
|  1 | Tejas   | Mumbai   |    14 |
+----+---------+----------+-------+
6 rows in set (0.00 sec)

mysql> select * from student order by name desc;
+----+---------+----------+-------+
| id | name    | city     | class |
+----+---------+----------+-------+
|  1 | Tejas   | Mumbai   |    14 |
|  4 | Savitra | Solapur  |    15 |
|  3 | Sanjay  | Sangli   |    14 |
|  6 | Rupesh  | Kohlapur |    15 |
|  2 | Ranjit  | Mumbai   |    15 |
|  5 | Ranjit  | Satara   |    14 |
+----+---------+----------+-------+
6 rows in set (0.00 sec)

mysql> select * from student order by name desc limit 2;
+----+---------+---------+-------+
| id | name    | city    | class |
+----+---------+---------+-------+
|  1 | Tejas   | Mumbai  |    14 |
|  4 | Savitra | Solapur |    15 |
+----+---------+---------+-------+
2 rows in set (0.00 sec)

mysql> update student set name = 'Yogesh' OR city = 'Solapur' where id = 5;
ERROR 1292 (22007): Truncated incorrect DOUBLE value: 'Yogesh'
mysql> select * from student;
+----+---------+----------+-------+
| id | name    | city     | class |
+----+---------+----------+-------+
|  1 | Tejas   | Mumbai   |    14 |
|  2 | Ranjit  | Mumbai   |    15 |
|  3 | Sanjay  | Sangli   |    14 |
|  4 | Savitra | Solapur  |    15 |
|  5 | Ranjit  | Satara   |    14 |
|  6 | Rupesh  | Kohlapur |    15 |
+----+---------+----------+-------+
6 rows in set (0.00 sec)

mysql> update student set name = 'Yogesh' where id = 5;
Query OK, 1 row affected (0.00 sec)
Rows matched: 1  Changed: 1  Warnings: 0

mysql> update student set city = 'Solapur' where id = 5;
Query OK, 1 row affected (0.00 sec)
Rows matched: 1  Changed: 1  Warnings: 0

mysql> select * from student;
+----+---------+----------+-------+
| id | name    | city     | class |
+----+---------+----------+-------+
|  1 | Tejas   | Mumbai   |    14 |
|  2 | Ranjit  | Mumbai   |    15 |
|  3 | Sanjay  | Sangli   |    14 |
|  4 | Savitra | Solapur  |    15 |
|  5 | Yogesh  | Solapur  |    14 |
|  6 | Rupesh  | Kohlapur |    15 |
+----+---------+----------+-------+
6 rows in set (0.00 sec)

mysql> select * from student where name like'_a%';
+----+---------+---------+-------+
| id | name    | city    | class |
+----+---------+---------+-------+
|  2 | Ranjit  | Mumbai  |    15 |
|  3 | Sanjay  | Sangli  |    14 |
|  4 | Savitra | Solapur |    15 |
+----+---------+---------+-------+
3 rows in set (0.00 sec)

mysql> select * from student where name like's%';
+----+---------+---------+-------+
| id | name    | city    | class |
+----+---------+---------+-------+
|  3 | Sanjay  | Sangli  |    14 |
|  4 | Savitra | Solapur |    15 |
+----+---------+---------+-------+
2 rows in set (0.00 sec)

mysql> select * from student where name like'';
Empty set (0.00 sec)

mysql> select * from student where name like'%r';
Empty set (0.00 sec)

mysql> select * from student where city like'%r';
+----+---------+----------+-------+
| id | name    | city     | class |
+----+---------+----------+-------+
|  4 | Savitra | Solapur  |    15 |
|  5 | Yogesh  | Solapur  |    14 |
|  6 | Rupesh  | Kohlapur |    15 |
+----+---------+----------+-------+
3 rows in set (0.00 sec)

mysql> select * from student where city like'%l____';
+----+---------+----------+-------+
| id | name    | city     | class |
+----+---------+----------+-------+
|  4 | Savitra | Solapur  |    15 |
|  5 | Yogesh  | Solapur  |    14 |
|  6 | Rupesh  | Kohlapur |    15 |
+----+---------+----------+-------+
3 rows in set (0.00 sec)

mysql> select * from student where city like'__l%';
+----+---------+---------+-------+
| id | name    | city    | class |
+----+---------+---------+-------+
|  4 | Savitra | Solapur |    15 |
|  5 | Yogesh  | Solapur |    14 |
+----+---------+---------+-------+
2 rows in set (0.00 sec)

mysql> select SUM(id) as SUM from student;
+------+
| SUM  |
+------+
|   21 |
+------+
1 row in set (0.00 sec)

mysql> select AVG(id) as AVG from student;
+--------+
| AVG    |
+--------+
| 3.5000 |
+--------+
1 row in set (0.00 sec)

mysql> select COUNT(id) as COUNT from student;
+-------+
| COUNT |
+-------+
|     6 |
+-------+
1 row in set (0.00 sec)

mysql> select COUNT as COUNT from student;
ERROR 1054 (42S22): Unknown column 'COUNT' in 'field list'
mysql> select COUNT(class) as COUNT from student limit 4;
+-------+
| COUNT |
+-------+
|     6 |
+-------+
1 row in set (0.00 sec)

mysql> select COUNT(class) as COUNT from student where limit 4;
ERROR 1064 (42000): You have an error in your SQL syntax; check the manual that corresponds to your MySQL server version for the right syntax to use near 'limit 4' at line 1
mysql> select COUNT(class) as COUNT from student;
+-------+
| COUNT |
+-------+
|     6 |
+-------+
1 row in set (0.00 sec)

mysql> select MIN(id) as Min from student;
+------+
| Min  |
+------+
|    1 |
+------+
1 row in set (0.00 sec)

mysql> select MAX(id) as Max from student;
+------+
| Max  |
+------+
|    6 |
+------+
1 row in set (0.00 sec)

mysql> select * from student where id = ( select MAX(id) from student where name));
ERROR 1064 (42000): You have an error in your SQL syntax; check the manual that corresponds to your MySQL server version for the right syntax to use near ')' at line 1
mysql> select * from student where id = ( select MAX(id) from student where name);
Empty set, 6 warnings (0.00 sec)

mysql> select * from student where id = ( select MAX(id) from student);
+----+--------+----------+-------+
| id | name   | city     | class |
+----+--------+----------+-------+
|  6 | Rupesh | Kohlapur |    15 |
+----+--------+----------+-------+
1 row in set (0.00 sec)

mysql> select city from student where id = ( select MAX(id) from student);
+----------+
| city     |
+----------+
| Kohlapur |
+----------+
1 row in set (0.00 sec)

mysql> select name from student s where s.id=?1;
ERROR 1064 (42000): You have an error in your SQL syntax; check the manual that corresponds to your MySQL server version for the right syntax to use near '?1' at line 1
mysql> select name from student s where s.id=1;
+-------+
| name  |
+-------+
| Tejas |
+-------+
1 row in set (0.00 sec)

mysql> create table laptop(laptop
    -> create table laptop(laptophq     io
    -> ;
ERROR 1064 (42000): You have an error in your SQL syntax; check the manual that corresponds to your MySQL server version for the right syntax to use near 'create table laptop(laptophq     io' at line 2
mysql> create table laptop(laptopId int primary key,model varchar(50),studentId int foreign key references student(id);
ERROR 1064 (42000): You have an error in your SQL syntax; check the manual that corresponds to your MySQL server version for the right syntax to use near 'foreign key references student(id)' at line 1
mysql> create table laptop(laptopId int primary key,model varchar(50),studentId int foreign key references student(id));
ERROR 1064 (42000): You have an error in your SQL syntax; check the manual that corresponds to your MySQL server version for the right syntax to use near 'foreign key references student(id))' at line 1
mysql> create table laptop(laptopId int primary key,model varchar(50),studentId int, foreign key (studentId) references student(id));
Query OK, 0 rows affected (0.03 sec)

mysql> desc laptop;
+-----------+-------------+------+-----+---------+-------+
| Field     | Type        | Null | Key | Default | Extra |
+-----------+-------------+------+-----+---------+-------+
| laptopId  | int         | NO   | PRI | NULL    |       |
| model     | varchar(50) | YES  |     | NULL    |       |
| studentId | int         | YES  | MUL | NULL    |       |
+-----------+-------------+------+-----+---------+-------+
3 rows in set (0.00 sec)

mysql> insert into laptop(laptopId,model,studentId) values (234,'Dell',3),(345,'Msi',5),(456,'Acer',1),(567,'Apple',2),(654,'Lenevo',4),(921,'Hp',6);
Query OK, 6 rows affected (0.00 sec)
Records: 6  Duplicates: 0  Warnings: 0

mysql> select * from student;
+----+---------+----------+-------+
| id | name    | city     | class |
+----+---------+----------+-------+
|  1 | Tejas   | Mumbai   |    14 |
|  2 | Ranjit  | Mumbai   |    15 |
|  3 | Sanjay  | Sangli   |    14 |
|  4 | Savitra | Solapur  |    15 |
|  5 | Yogesh  | Solapur  |    14 |
|  6 | Rupesh  | Kohlapur |    15 |
+----+---------+----------+-------+
6 rows in set (0.00 sec)

mysql> select * from laptop;
+----------+--------+-----------+
| laptopId | model  | studentId |
+----------+--------+-----------+
|      234 | Dell   |         3 |
|      345 | Msi    |         5 |
|      456 | Acer   |         1 |
|      567 | Apple  |         2 |
|      654 | Lenevo |         4 |
|      921 | Hp     |         6 |
+----------+--------+-----------+
6 rows in set (0.00 sec)

mysql> select student.name, laptop.laptopId, laptop.model from student, laptop where student.id = laptop.studentId;
+---------+----------+--------+
| name    | laptopId | model  |
+---------+----------+--------+
| Tejas   |      456 | Acer   |
| Ranjit  |      567 | Apple  |
| Sanjay  |      234 | Dell   |
| Savitra |      654 | Lenevo |
| Yogesh  |      345 | Msi    |
| Rupesh  |      921 | Hp     |
+---------+----------+--------+
6 rows in set (0.00 sec)

mysql> select student.name, laptop.laptopId, laptop.model from student, laptop where student.id = laptop.studentId and laptop.model = 'Apple';
+--------+----------+-------+
| name   | laptopId | model |
+--------+----------+-------+
| Ranjit |      567 | Apple |
+--------+----------+-------+
1 row in set (0.00 sec)

mysql> select student.name, laptop.laptopId, laptop.model from student inner join laptop on student.id = laptop.studentId;
+---------+----------+--------+
| name    | laptopId | model  |
+---------+----------+--------+
| Tejas   |      456 | Acer   |
| Ranjit  |      567 | Apple  |
| Sanjay  |      234 | Dell   |
| Savitra |      654 | Lenevo |
| Yogesh  |      345 | Msi    |
| Rupesh  |      921 | Hp     |
+---------+----------+--------+
6 rows in set (0.00 sec)

mysql>
